,col_num,Text,None_emotion,Happy/Joyful,Engaged,Curious/Interested,Suprised,Confident,Hopeful,Proud,Empathy,Confused,Frustrated,Angry,Worry,Anxious,Fearful,Bored,Sad,Hopeless,Exhausted/Tired,Shamed/Apologetic,Other_emotion,None_positive,Clear Direction,Enough Knowledge,Sense of Achievements,Good Timing,Adequate Project Scope,Good Team Communication,Good Team Collaboration,Good Project Monitoring ,Good Client Communication,Good Academic Staff Communication,Personality Match,Discovery,Other_positive,None_issue,Lack of Direction,Limited Knowledge,Technical Issues,Lack of Achievements,Time Pressure,Project Scope - too big,Project Scope - too small,Team Communication,Team Collaboration,Project Monitoring,Client Communication,Academic Staff Communication,Personality Clash,Hindsights,Additional Commitments,Other_issue
0,0,What we've done this week.,1,0,0,0,0,0,0,0,0,0,0,0,0,0,0,0,0,0,0,0,0,1,0,0,0,0,0,0,0,0,0,0,0,0,0,1,0,0,0,0,0,0,0,0,0,0,0,0,0,0,0,0
1,1,"Similar to last week we had 3 team meetings, one with Jeremiah and further implemented code in the UI and experimented with more algorithms in the back end.",1,0,0,0,0,0,0,0,0,0,0,0,0,0,0,0,0,0,0,0,0,1,0,0,0,0,0,0,0,0,0,0,0,0,0,1,0,0,0,0,0,0,0,0,0,0,0,0,0,0,0,0
2,2,The good,1,0,0,0,0,0,0,0,0,0,0,0,0,0,0,0,0,0,0,0,0,1,0,0,0,0,0,0,0,0,0,0,0,0,0,1,0,0,0,0,0,0,0,0,0,0,0,0,0,0,0,0
3,3,We managed to get a decent amount of work done as a team and Jeremiah seemed to be impressed with what we presented with him so far.,0,1,0,0,0,0,0,0,0,0,0,0,0,0,0,0,0,0,0,0,0,0,0,0,1,0,0,0,0,0,0,1,0,0,0,1,0,0,0,0,0,0,0,0,0,0,0,0,0,0,0,0
4,4,The UI has started to improve a lot since we started on it and will hopefully continue to improve as we go along.,0,0,0,0,0,0,1,0,0,0,0,0,0,0,0,0,0,0,0,0,0,0,0,0,0,0,0,0,0,0,0,0,0,1,0,1,0,0,0,0,0,0,0,0,0,0,0,0,0,0,0,0
5,5,As a team we did a good job of keeping in touch with each other and taking initiatives to get tasks done and are slowly finding solutions to get our project complete.,0,1,0,0,0,0,0,0,0,0,0,0,0,0,0,0,0,0,0,0,0,0,0,0,0,0,0,1,1,0,0,0,0,0,0,1,0,0,0,0,0,0,0,0,0,0,0,0,0,0,0,0
6,6,Things to improve as a team,1,0,0,0,0,0,0,0,0,0,0,0,0,0,0,0,0,0,0,0,0,1,0,0,0,0,0,0,0,0,0,0,0,0,0,1,0,0,0,0,0,0,0,0,0,0,0,0,0,0,0,0
7,7,The main aspect to improve as a team is too make sure we have a clear list of priorities for our project so we are not spending too much time on aspects that we will not implement.,1,0,0,0,0,0,0,0,0,0,0,0,0,0,0,0,0,0,0,0,0,1,0,0,0,0,0,0,0,0,0,0,0,0,0,1,0,0,0,0,0,0,0,0,0,0,0,0,0,0,0,0
8,8,We addressed this on Friday and tried to figure out what features we really need and broke down each step to know what we need to do.,1,0,0,0,0,0,0,0,0,0,0,0,0,0,0,0,0,0,0,0,0,1,0,0,0,0,0,0,0,0,0,0,0,0,0,1,0,0,0,0,0,0,0,0,0,0,0,0,0,0,0,0
9,9,"I'm hoping we can continue to prioritise and execute, so that we have a productive last two weeks.",0,0,0,0,0,0,1,0,0,0,0,0,0,0,0,0,0,0,0,0,0,0,1,0,0,0,0,0,0,0,0,0,0,0,0,1,0,0,0,0,0,0,0,0,0,0,0,0,0,0,0,0
10,10,I also feel that at times we get caught speaking about tasks at a abstract level for too long and not figure out how to actually implement these solutions.,0,0,0,0,0,0,0,0,0,0,1,0,0,0,0,0,0,0,0,0,0,1,0,0,0,0,0,0,0,0,0,0,0,0,0,0,0,1,0,0,0,0,0,0,0,0,0,0,0,0,0,0
11,11,This could be addressed by testing ideas as we discuss them to figure out if we can actually do them.,1,0,0,0,0,0,0,0,0,0,0,0,0,0,0,0,0,0,0,0,0,1,0,0,0,0,0,0,0,0,0,0,0,0,0,1,0,0,0,0,0,0,0,0,0,0,0,0,0,0,0,0
12,12,Things I could do betterI felt I spent too much time on features for our app that we may not utilise given the time period.,0,0,0,0,0,0,0,0,0,0,1,0,0,0,0,0,0,0,0,0,0,1,0,0,0,0,0,0,0,0,0,0,0,0,0,0,1,0,0,1,0,0,0,0,0,0,0,0,0,0,0,0
13,13,I focused to much on things that were nice to have and not essential and was a little frustrated as I had a similar experience in the last project.,0,0,0,0,0,0,0,0,0,0,1,0,0,0,0,0,0,0,0,0,0,1,0,0,0,0,0,0,0,0,0,0,0,0,0,0,1,0,0,0,0,0,0,0,0,0,0,0,0,0,0,0
14,14,"However, this might be a factor in all projects as there will always be a change of direction in the project.",1,0,0,0,0,0,0,0,0,0,0,0,0,0,0,0,0,0,0,0,0,1,0,0,0,0,0,0,0,0,0,0,0,0,0,1,0,0,0,0,0,0,0,0,0,0,0,0,0,0,0,0
15,15,"To help combat this issue this week, I will need to make sure I have a full understanding of the high priority tasks that need to get done for the week.",0,0,1,0,0,0,0,0,0,0,0,0,0,0,0,0,0,0,0,0,0,0,0,1,0,0,0,0,0,0,0,0,0,0,0,1,0,0,0,0,0,0,0,0,0,0,0,0,0,0,0,0
16,16,This understanding will also need to be paired with better time management to ensure I am not spending too much time on non essential tasks.,1,0,0,0,0,0,0,0,0,0,0,0,0,0,0,0,0,0,0,0,0,1,0,0,0,0,0,0,0,0,0,0,0,0,0,1,0,0,0,0,0,0,0,0,0,0,0,0,0,0,0,0
17,17,Goals for next week.,1,0,0,0,0,0,0,0,0,0,0,0,0,0,0,0,0,0,0,0,0,1,0,0,0,0,0,0,0,0,0,0,0,0,0,1,0,0,0,0,0,0,0,0,0,0,0,0,0,0,0,0
18,18,"The goals for the upcoming week are to finally get a meeting with the anatomy department, as we weren't able to secure for the last two weeks.",1,0,0,0,0,0,0,0,0,0,0,0,0,0,0,0,0,0,0,0,0,1,0,0,0,0,0,0,0,0,0,0,0,0,0,1,0,0,0,0,0,0,0,0,0,0,0,0,0,0,0,0
19,19,The technical tasks for our project are to add a merge and split function and hopefully a method to allow a user to choose custom labels for each class in the image.,1,0,0,0,0,0,0,0,0,0,0,0,0,0,0,0,0,0,0,0,0,1,0,0,0,0,0,0,0,0,0,0,0,0,0,1,0,0,0,0,0,0,0,0,0,0,0,0,0,0,0,0
20,20,General thoughts,1,0,0,0,0,0,0,0,0,0,0,0,0,0,0,0,0,0,0,0,0,1,0,0,0,0,0,0,0,0,0,0,0,0,0,1,0,0,0,0,0,0,0,0,0,0,0,0,0,0,0,0
21,21,The project has been going pretty smoothly as a team but I have again felt a sense that I have not done enough work towards the project.,0,1,0,0,0,0,0,0,0,0,1,0,0,0,0,0,0,0,0,0,0,0,0,0,0,0,0,1,1,0,0,0,0,0,0,0,0,0,0,1,0,0,0,0,0,0,0,0,0,0,0,0
22,22,"If I were to look at the hours spent on the project I have most likely spent much longer than 20 hours on it, but there is a lingering feeling of not enough has been done.",0,0,0,0,0,0,0,0,0,0,1,0,0,0,0,0,0,0,0,0,0,1,0,0,0,0,0,0,0,0,0,0,0,0,0,0,0,0,0,1,0,0,0,0,0,0,0,0,0,0,0,0
23,23,I'm beginning to realise this is something that has been present throughout all three projects and may be more related to my own expectations of what we can produce.,1,0,0,0,0,0,0,0,0,0,0,0,0,0,0,0,0,0,0,0,0,1,0,0,0,0,0,0,0,0,0,0,0,0,0,1,0,0,0,0,0,0,0,0,0,0,0,0,0,0,0,0
24,24,It might be that I am too hard on myself for not being able to produce something that I cannot yet do given my skills and the project timeframes.,0,0,0,0,0,0,0,0,0,0,1,0,0,0,0,0,0,0,0,0,0,1,0,0,0,0,0,0,0,0,0,0,0,0,0,0,0,0,0,1,0,0,0,0,0,0,0,0,0,0,0,0
25,25,I feel I should most likely just focus on learning things that are of high importance to the project as opposed to trying to master everything in a few weeks.,0,0,1,0,0,0,0,0,0,0,0,0,0,0,0,0,0,0,0,0,0,0,1,0,0,0,0,0,0,0,0,0,0,0,0,1,0,0,0,0,0,0,0,0,0,0,0,0,0,0,0,0
26,26,"With only two weeks remaining, I'm also left with a bittersweet feeling as things are almost coming to an end for course work this year.",0,0,0,0,0,0,0,0,0,0,0,0,0,0,0,0,1,0,0,0,0,1,0,0,0,0,0,0,0,0,0,0,0,0,0,1,0,0,0,0,0,0,0,0,0,0,0,0,0,0,0,0
27,27,It has been a great year so far with new friendships and will be sad to see some people go.,0,0,0,0,0,0,0,0,0,0,0,0,0,0,0,0,1,0,0,0,0,1,0,0,0,0,0,0,0,0,0,0,0,0,0,1,0,0,0,0,0,0,0,0,0,0,0,0,0,0,0,0
28,28,Gogo make the most of things as we head to the finish line!,1,0,0,0,0,0,0,0,0,0,0,0,0,0,0,0,0,0,0,0,0,1,0,0,0,0,0,0,0,0,0,0,0,0,0,1,0,0,0,0,0,0,0,0,0,0,0,0,0,0,0,0
29,29,Overall,0,1,1,0,0,0,0,0,0,0,0,0,0,0,0,0,1,0,0,0,0,0,1,0,0,0,0,1,1,0,0,0,0,0,0,0,1,1,0,1,0,0,0,0,0,0,0,0,0,0,0,0