,col_num,Text,None_emotion,Happy/Joyful,Engaged,Curious/Interested,Suprised,Confident,Hopeful,Proud,Empathy,Confused,Frustrated,Angry,Worry,Anxious,Fearful,Bored,Sad,Hopeless,Exhausted/Tired,Shamed/Apologetic,Other_emotion,None_positive,Clear Direction,Enough Knowledge,Sense of Achievements,Good Timing,Adequate Project Scope,Good Team Communication,Good Team Collaboration,Good Project Monitoring ,Good Client Communication,Good Academic Staff Communication,Personality Match,Discovery,Other_positive,None_issue,Lack of Direction,Limited Knowledge,Technical Issues,Lack of Achievements,Time Pressure,Project Scope - too big,Project Scope - too small,Team Communication,Team Collaboration,Project Monitoring,Client Communication,Academic Staff Communication,Personality Clash,Hindsights,Additional Commitments,Other_issue
0,0,"The goals for this week were to finish our written project proposal and perhaps do some initial work on our project - for me, that was playing around with web scraping on R or Python or whatever language was necessary.",0,0,1,0,0,0,0,0,0,0,0,0,0,0,0,0,0,0,0,0,0,0,1,0,0,0,0,0,0,0,0,0,0,0,0,1,0,0,0,0,0,0,0,0,0,0,0,0,0,0,0,0
1,1,"Because I was taught web scraping in COMP120, navigating R to do this task is essentially a no-brainer for me.",0,0,1,0,0,0,0,0,0,0,0,0,0,0,0,0,0,0,0,0,0,0,0,1,1,0,0,0,0,0,0,0,0,0,0,1,0,0,0,0,0,0,0,0,0,0,0,0,0,0,0,0
2,2,"Now - the issue with this is that Susu doesn't want to use R.  I think she may have been traumatised from using R in her last studio project, but, I feel as though it would be okay, because if I undergo all the web scraping, she won't have to touch R.  After all, I asked her if she would like to undergo some web scraping and that is why she doesn't want to use R.  If so, I am willing to compromise and  learn it in another language, however, she says she doesn't plan on doing any web scraping.",0,0,0,0,0,0,0,0,1,0,0,0,0,0,0,0,0,0,0,0,0,0,0,0,0,0,0,1,1,0,0,0,0,0,0,1,0,0,0,0,0,0,0,0,0,0,0,0,0,0,0,0
3,3,"So, at this point Teacher1 has introduced web scraping through Excel to us.",0,0,1,0,0,0,0,0,0,0,0,0,0,0,0,0,0,0,0,0,0,0,0,0,0,0,0,0,0,0,0,1,0,0,0,1,0,0,0,0,0,0,0,0,0,0,0,0,0,0,0,0
4,4,Awesome!,0,1,0,0,0,0,0,0,0,0,0,0,0,0,0,0,0,0,0,0,0,1,0,0,0,0,0,0,0,0,0,0,0,0,0,1,0,0,0,0,0,0,0,0,0,0,0,0,0,0,0,0
5,5,I am happy to do it through excel if it makes her happy.,0,1,0,0,0,0,0,0,1,0,0,0,0,0,0,0,0,0,0,0,0,0,0,0,0,0,0,1,1,0,0,0,0,0,0,1,0,0,0,0,0,0,0,0,0,0,0,0,0,0,0,0
6,6,"However, since we are both Mac users we have found that PowerQuery is not available on Excel for Mac users.",0,0,0,0,0,0,0,0,0,0,1,0,0,0,0,0,0,0,0,0,0,1,0,0,0,0,0,0,0,0,0,0,0,0,0,0,0,0,1,0,0,0,0,0,0,0,0,0,0,0,0,0
7,7,"Yet again, a bump in the road - but we can do the scraping through student desktop.",0,1,0,0,0,0,0,0,0,0,0,0,0,0,0,0,0,0,0,0,0,0,0,0,0,0,0,0,0,0,0,0,0,1,0,1,0,0,0,0,0,0,0,0,0,0,0,0,0,0,0,0
8,8,"Now, to reflect upon this situation - if I am honest, it is disheartening to not have some compromisation on Susu's end.",0,0,0,0,0,0,0,0,0,0,1,0,0,0,0,0,0,0,0,0,0,1,0,0,0,0,0,0,0,0,0,0,0,0,0,0,0,0,0,0,0,0,0,0,1,0,0,0,0,0,0,0
9,9,I am trying to understand her thoughts about it and maybe she is concerned that the client won't know how to use R so that is why she is always pushing for an alternative language.,0,0,0,0,0,0,0,0,1,0,0,0,0,0,0,0,0,0,0,0,0,0,0,0,0,0,0,0,0,0,0,0,1,0,0,1,0,0,0,0,0,0,0,0,0,0,0,0,0,0,0,0
10,10,"I thought that perhaps in our deliverables we could describe web scraping using Excel for Kevin, as an alternative (backup) solution.",0,0,0,1,0,0,0,0,0,0,0,0,0,0,0,0,0,0,0,0,0,1,0,0,0,0,0,0,0,0,0,0,0,0,0,1,0,0,0,0,0,0,0,0,0,0,0,0,0,0,0,0
11,11,"Overall, I am still likely to web scrape through R, because this is the area I want to develop my learning/skill and what I am most comfortable and confident in doing.",0,0,0,0,0,0,1,0,0,0,0,0,0,0,0,0,0,0,0,0,0,0,0,1,0,0,0,0,0,0,0,0,0,0,0,1,0,0,0,0,0,0,0,0,0,0,0,0,0,0,0,0
12,12,"Perhaps on the side too, I will do some web scraping through Excel to satisfy Susu and understand this method in preparation to describe to our client.",0,0,0,1,0,0,0,0,0,0,0,0,0,0,0,0,0,0,0,0,0,0,0,0,0,0,0,0,1,0,0,0,0,0,0,1,0,0,0,0,0,0,0,0,0,0,0,0,0,0,0,0
13,13,Guess we will see how this new week goes hehe!,0,0,0,1,0,0,0,0,0,0,0,0,0,0,0,0,0,0,0,0,0,1,0,0,0,0,0,0,0,0,0,0,0,0,0,1,0,0,0,0,0,0,0,0,0,0,0,0,0,0,0,0
14,14,Overall,0,0,1,1,0,0,0,0,1,0,0,0,0,0,0,0,0,0,0,0,0,0,0,1,0,0,0,1,1,0,0,0,0,0,0,0,0,0,1,0,0,0,0,0,1,0,0,0,0,0,0,0