,col_num,Text,None_emotion,Happy/Joyful,Engaged,Curious/Interested,Suprised,Confident,Hopeful,Proud,Empathy,Confused,Frustrated,Angry,Worry,Anxious,Fearful,Bored,Sad,Hopeless,Exhausted/Tired,Shamed/Apologetic,Other_emotion,None_positive,Clear Direction,Enough Knowledge,Sense of Achievements,Good Timing,Adequate Project Scope,Good Team Communication,Good Team Collaboration,Good Project Monitoring ,Good Client Communication,Good Academic Staff Communication,Personality Match,Discovery,Other_positive,None_issue,Lack of Direction,Limited Knowledge,Technical Issues,Lack of Achievements,Time Pressure,Project Scope - too big,Project Scope - too small,Team Communication,Team Collaboration,Project Monitoring,Client Communication,Academic Staff Communication,Personality Clash,Hindsights,Additional Commitments,Other_issue
0,0,"For this last blog post for project three, I'd like to muse a bit on why I often feel like I'm struggling to make our team's application work, and how this whole project has really brought home the importance of design patterns and principles.",0,0,0,0,0,0,0,0,0,0,1,0,0,0,0,0,0,0,0,0,0,1,0,0,0,0,0,0,0,0,0,0,0,0,0,0,0,1,0,0,0,0,0,0,0,0,0,0,0,1,0,0
1,1,"I've always found the Unix-philosophy of ""do one thing and do it well"" beneficial.",0,1,0,0,0,0,0,0,0,0,0,0,0,0,0,0,0,0,0,0,0,0,0,1,0,0,0,0,0,0,0,0,0,1,0,1,0,0,0,0,0,0,0,0,0,0,0,0,0,0,0,0
2,2,Your code focuses on one task and it allows each individual with different strengths to work on their preferred module.,1,0,0,0,0,0,0,0,0,0,0,0,0,0,0,0,0,0,0,0,0,1,0,0,0,0,0,0,0,0,0,0,0,0,0,1,0,0,0,0,0,0,0,0,0,0,0,0,0,0,0,0
3,3,It also forces you to break down your task into smaller ones until it's no longer practical to do so.,1,0,0,0,0,0,0,0,0,0,0,0,0,0,0,0,0,0,0,0,0,1,0,0,0,0,0,0,0,0,0,0,0,0,0,1,0,0,0,0,0,0,0,0,0,0,0,0,0,0,0,0
4,4,"And having distinct, manageable tasks are key to productivity.",1,0,0,0,0,0,0,0,0,0,0,0,0,0,0,0,0,0,0,0,0,1,0,0,0,0,0,0,0,0,0,0,0,0,0,1,0,0,0,0,0,0,0,0,0,0,0,0,0,0,0,0
5,5,"Plus, if your programs and functions are functional, meaning they always return X if Y is given as parameter and has no side effect, it makes it a lot easier to test, maintain, debug and generally reason about.",1,0,0,0,0,0,0,0,0,0,0,0,0,0,0,0,0,0,0,0,0,1,0,0,0,0,0,0,0,0,0,0,0,0,0,1,0,0,0,0,0,0,0,0,0,0,0,0,0,0,0,0
6,6,"Against that background, our choice of framework (Model - View - View Model) is designed to do that.",1,0,0,0,0,0,0,0,0,0,0,0,0,0,0,0,0,0,0,0,0,1,0,0,0,0,0,0,0,0,0,0,0,0,0,1,0,0,0,0,0,0,0,0,0,0,0,0,0,0,0,0
7,7,"The model mirrors a table in the database, and only contains data definition.",1,0,0,0,0,0,0,0,0,0,0,0,0,0,0,0,0,0,0,0,0,1,0,0,0,0,0,0,0,0,0,0,0,0,0,1,0,0,0,0,0,0,0,0,0,0,0,0,0,0,0,0
8,8,The view only contains markup and styling.,1,0,0,0,0,0,0,0,0,0,0,0,0,0,0,0,0,0,0,0,0,1,0,0,0,0,0,0,0,0,0,0,0,0,0,1,0,0,0,0,0,0,0,0,0,0,0,0,0,0,0,0
9,9,"The View Model handles the data binding, which basically means what properties of the Model the View should display and which component should do so.",1,0,0,0,0,0,0,0,0,0,0,0,0,0,0,0,0,0,0,0,0,1,0,0,0,0,0,0,0,0,0,0,0,0,0,1,0,0,0,0,0,0,0,0,0,0,0,0,0,0,0,0
10,10,"So in essence designers can work on the overall look, while members with a more logical leaning can focus on the business logic.",1,0,0,0,0,0,0,0,0,0,0,0,0,0,0,0,0,0,0,0,0,1,0,0,0,0,0,0,0,0,0,0,0,0,0,1,0,0,0,0,0,0,0,0,0,0,0,0,0,0,0,0
11,11,And we did kind of achieve that separation of concern during the last 2 or 3 weeks.,0,1,0,0,0,0,0,0,0,0,0,0,0,0,0,0,0,0,0,0,0,0,0,0,1,0,0,0,0,0,0,0,0,0,0,1,0,0,0,0,0,0,0,0,0,0,0,0,0,0,0,0
12,12,But another equally important factor that affects how we plan our code is user experience and expectations.,1,0,0,0,0,0,0,0,0,0,0,0,0,0,0,0,0,0,0,0,0,1,0,0,0,0,0,0,0,0,0,0,0,0,0,1,0,0,0,0,0,0,0,0,0,0,0,0,0,0,0,0
13,13,"What this means is that our users prefer to do everything in one place, from one page, and reporting nature of the application also means that our models are often mixed up together in one place.",1,0,0,0,0,0,0,0,0,0,0,0,0,0,0,0,0,0,0,0,0,1,0,0,0,0,0,0,0,0,0,0,0,0,0,1,0,0,0,0,0,0,0,0,0,0,0,0,0,0,0,0
14,14,"The same view is then reused for all CRUD operations which often involve 2 or 3 models due to the interconnected nature of the system, and it's really hard to make it all work, and it feels really discouraging at times as the application is slow due to our hosted database and the obscure nature of data binding debugging, which often runs but doesn't do what you want and so there's no error message to guide you.",0,0,0,0,0,0,0,0,0,1,1,0,0,0,0,0,0,0,0,0,0,1,0,0,0,0,0,0,0,0,0,0,0,0,0,0,1,1,1,0,0,0,0,0,0,0,0,0,0,0,0,0
15,15,"But still, I did manage to somewhat follow what I think it's good practices in other places.",0,1,0,0,0,0,0,0,0,0,0,0,0,0,0,0,0,0,0,0,0,0,0,0,1,0,0,0,0,0,0,0,0,0,0,1,0,0,0,0,0,0,0,0,0,0,0,0,0,0,0,0
16,16,"To reduce code duplication, I wrote certain base classes, generics, and interfaces for our models and database services.",0,0,1,0,0,0,0,0,0,0,0,0,0,0,0,0,0,0,0,0,0,0,1,1,0,0,0,0,0,0,0,0,0,0,0,1,0,0,0,0,0,0,0,0,0,0,0,0,0,0,0,0
17,17,"The folders clearly group modules based on their tasks, and you wouldn't know how much of a mess everything is at first glance.",1,0,0,0,0,0,0,0,0,0,0,0,0,0,0,0,0,0,0,0,0,1,0,0,0,0,0,0,0,0,0,0,0,0,0,1,0,0,0,0,0,0,0,0,0,0,0,0,0,0,0,0
18,18,"There were definitely times where I felt I should have reflected on how much impact our user-friendly designs would have on our developer experience, or pushed for a more single-purpose design.",0,0,0,0,0,0,0,0,0,0,1,0,0,0,0,0,0,0,0,0,0,1,0,0,0,0,0,0,0,0,0,0,0,0,0,0,0,1,0,1,0,0,0,0,0,0,0,0,0,0,0,0
19,19,"But the power dynamics is hard to navigate, with Bibi being the obvious experienced lead who seems to make it work regardless, while Gogo and Susu always have UX as their first priorities.",0,0,0,0,0,0,0,0,0,0,1,0,0,0,0,0,0,0,0,0,0,1,0,0,0,0,0,0,0,0,0,0,0,0,0,0,1,1,0,0,0,0,0,0,0,0,0,0,0,0,0,0
20,20,"In the end I felt I've pulled my weight where I needed to, and I learned a lot so it's okay.",0,1,0,0,0,0,0,0,0,0,0,0,0,0,0,0,0,0,0,0,0,0,0,0,1,0,0,0,0,0,0,0,0,0,0,1,0,0,0,0,0,0,0,0,0,0,0,0,0,0,0,0
21,21,"For this week, besides my portfolio, I'll try to finish my two remaining features and call it done.",0,0,1,0,0,0,0,0,0,0,0,0,0,0,0,0,0,0,0,0,0,0,1,1,0,1,0,0,0,0,0,0,0,0,0,1,0,0,0,0,0,0,0,0,0,0,0,0,0,0,0,0
22,22,"It's time for me to move on, and I really want to apply what I've learnt by starting afresh on my next project.",0,0,1,0,0,0,0,0,0,0,0,0,0,0,0,0,0,0,0,0,0,0,0,1,0,0,0,0,0,0,0,0,0,0,0,1,0,0,0,0,0,0,0,0,0,0,0,0,0,0,0,0
23,23,Overall,0,1,1,0,0,0,0,0,0,0,1,0,0,0,0,0,0,0,0,0,0,0,1,1,1,0,0,0,0,0,0,0,0,0,0,0,0,1,0,1,0,0,0,0,0,0,0,0,0,0,0,0