,col_num,Text,None_emotion,Happy/Joyful,Engaged,Curious/Interested,Suprised,Confident,Hopeful,Proud,Empathy,Confused,Frustrated,Angry,Worry,Anxious,Fearful,Bored,Sad,Hopeless,Exhausted/Tired,Shamed/Apologetic,Other_emotion,None_positive,Clear Direction,Enough Knowledge,Sense of Achievements,Good Timing,Adequate Project Scope,Good Team Communication,Good Team Collaboration,Good Project Monitoring ,Good Client Communication,Good Academic Staff Communication,Personality Match,Discovery,Other_positive,None_issue,Lack of Direction,Limited Knowledge,Technical Issues,Lack of Achievements,Time Pressure,Project Scope - too big,Project Scope - too small,Team Communication,Team Collaboration,Project Monitoring,Client Communication,Academic Staff Communication,Personality Clash,Hindsights,Additional Commitments,Other_issue
0,0,"Theoretically, it is the first week of our new project.",1,0,0,0,0,0,0,0,0,0,0,0,0,0,0,0,0,0,0,0,0,1,0,0,0,0,0,0,0,0,0,0,0,0,0,1,0,0,0,0,0,0,0,0,0,0,0,0,0,0,0,0
1,1,The new one and the last in teams.,1,0,0,0,0,0,0,0,0,0,0,0,0,0,0,0,0,0,0,0,0,1,0,0,0,0,0,0,0,0,0,0,0,0,0,1,0,0,0,0,0,0,0,0,0,0,0,0,0,0,0,0
2,2,Practically I have an impression that we are almost after two weeks of the project and do not know when it passed.,0,0,0,0,1,0,0,0,0,0,0,0,0,0,0,0,0,0,0,0,0,0,0,0,0,0,0,0,0,0,0,0,0,1,0,1,0,0,0,0,0,0,0,0,0,0,0,0,0,0,0,0
3,3,"We are already after pitch, after the proposal, after the poster preparation.",1,0,0,0,0,0,0,0,0,0,0,0,0,0,0,0,0,0,0,0,0,1,0,0,0,0,0,0,0,0,0,0,0,0,0,1,0,0,0,0,0,0,0,0,0,0,0,0,0,0,0,0
4,4,When?.How??,1,0,0,0,0,0,0,0,0,0,0,0,0,0,0,0,0,0,0,0,0,1,0,0,0,0,0,0,0,0,0,0,0,0,0,1,0,0,0,0,0,0,0,0,0,0,0,0,0,0,0,0
5,5,"After experiences during my second project and the listening teams' final presentations at the end of the second projects, I try to be openminded.",1,0,0,0,0,0,0,0,0,0,0,0,0,0,0,0,0,0,0,0,0,1,0,0,0,0,0,0,0,0,0,0,0,0,0,1,0,0,0,0,0,0,0,0,0,0,0,0,0,0,0,0
6,6,But I also communicate straight forward what I think even if I do not agree with some solutions or I would like to explore more another part of the project.,0,0,0,0,0,1,0,0,0,0,0,0,0,0,0,0,0,0,0,0,0,0,0,1,0,0,0,1,0,0,0,0,0,0,0,1,0,0,0,0,0,0,0,0,0,0,0,0,0,0,0,0
7,7,"I do not know if it is good or not, but I would like to enjoy this project and focus on the important aspects.",1,0,0,0,0,0,0,0,0,0,0,0,0,0,0,0,0,0,0,0,0,1,0,0,0,0,0,0,0,0,0,0,0,0,0,1,0,0,0,0,0,0,0,0,0,0,0,0,0,0,0,0
8,8,"On the other hand, I think that all of us try to be more open especial after Friday's Teacher3's presentation and think about the others.",0,0,1,0,0,0,0,0,0,0,0,0,0,0,0,0,0,0,0,0,0,0,0,0,0,0,0,1,0,0,0,0,0,0,0,1,0,0,0,0,0,0,0,0,0,0,0,0,0,0,0,0
9,9,"The real challenge for each person is to admit that she/he does not know something, and everything requires time and will to explore new fields/languages and acceptance from the rest of the team.",0,0,0,0,0,0,0,0,0,0,1,0,1,0,0,0,0,0,0,0,0,1,0,0,0,0,0,0,0,0,0,0,0,0,0,0,0,1,0,0,0,0,0,1,0,0,0,0,0,0,0,0
10,10,I hope that we will find the solution and at least one piece of this project will work.,0,0,0,0,0,0,1,0,0,0,0,0,0,0,0,0,0,0,0,0,0,1,0,0,0,0,0,0,0,0,0,0,0,0,0,1,0,0,0,0,0,0,0,0,0,0,0,0,0,0,0,0
11,11,"I have English lessons regularly and I hope that it will help me to communicate difficult matters in a more appropriate way, not only during the project but also for the future in other circumstances.",1,0,0,0,0,0,0,0,0,0,0,0,0,0,0,0,0,0,0,0,0,1,0,0,0,0,0,0,0,0,0,0,0,0,0,1,0,0,0,0,0,0,0,0,0,0,0,0,0,0,0,0
12,12,"The teamwork was quite smooth during the last three weeks: the week with the pitch, the mid-sem break (we had meetings through zoom to prepare the questions for the client and the base for the poster) and the official first week.",0,1,1,0,0,0,0,0,0,0,0,0,0,0,0,0,0,0,0,0,0,0,0,0,0,0,0,1,1,0,0,0,0,0,0,1,0,0,0,0,0,0,0,0,0,0,0,0,0,0,0,0
13,13,We had sometimes different opinions but we have come to a consensus or a compromise fast or decided that we will consider this aspect if we have more information or research.,1,0,0,0,0,0,0,0,0,0,0,0,0,0,0,0,0,0,0,0,0,1,0,0,0,0,0,0,0,0,0,0,0,0,0,1,0,0,0,0,0,0,0,0,0,0,0,0,0,0,0,0
14,14,"The all parts for communication were set, like Teams, What's up, Trello, GitHub.",1,0,0,0,0,0,0,0,0,0,0,0,0,0,0,0,0,0,0,0,0,1,0,0,0,0,0,0,0,0,0,0,0,0,0,1,0,0,0,0,0,0,0,0,0,0,0,0,0,0,0,0
15,15,It was really so fast and smooth.,0,0,0,0,1,0,0,0,0,0,0,0,0,0,0,0,0,0,0,0,0,0,1,0,0,0,0,0,0,0,0,0,0,0,0,1,0,0,0,0,0,0,0,0,0,0,0,0,0,0,0,0
16,16,"Right now we focus on research, communication with our client regularly and programming.Step by step.",0,0,1,0,0,0,0,0,0,0,0,0,0,0,0,0,0,0,0,0,0,0,1,0,0,0,0,1,0,0,0,0,0,0,0,1,0,0,0,0,0,0,0,0,0,0,0,0,0,0,0,0
17,17,Our goals for the next week: 1/prepare and test one part for the team changing and on-call hours (Roro started this part already)2/ prepare low-fidelity prototype of UI and reports3/ for me to explore the Visual Studio - I hope that Gogo shows us how we can use it in an efficient way4/ start prepare high-fidelity prototype of UI 5/ work on uses cases    The main task for me for the coming week:  to prepare reports mockup and UI for reports.,0,0,1,0,0,0,1,0,0,0,0,0,0,0,0,0,0,0,0,0,0,0,1,0,0,0,0,0,1,0,0,0,0,0,0,1,0,0,0,0,0,0,0,0,0,0,0,0,0,0,0,0
18,18,To explore the Visual Studio and start to learn C# (Bibi will prepare some examples fro the laymen😄 ).,1,0,0,0,0,0,0,0,0,0,0,0,0,0,0,0,0,0,0,0,0,1,0,0,0,0,0,0,0,0,0,0,0,0,0,1,0,0,0,0,0,0,0,0,0,0,0,0,0,0,0,0
19,19,"Going back to what happened up to this time: We had 9 meetings already:  via zoom, Teams and in person.",1,0,0,0,0,0,0,0,0,0,0,0,0,0,0,0,0,0,0,0,0,1,0,0,0,0,0,0,0,0,0,0,0,0,0,1,0,0,0,0,0,0,0,0,0,0,0,0,0,0,0,0
20,20,What I like is that when we meet we know that this is time for the project.,1,0,0,0,0,0,0,0,0,0,0,0,0,0,0,0,0,0,0,0,0,1,0,0,0,0,0,0,0,0,0,0,0,0,0,0,0,0,0,0,0,0,0,0,0,0,0,0,0,0,0,0
21,21,"Even if we are working in silence we know, that each of us works under the piece of the current task for example.",1,0,0,0,0,0,0,0,0,0,0,0,0,0,0,0,0,0,0,0,0,1,0,0,0,0,0,0,0,0,0,0,0,0,0,0,0,0,0,0,0,0,0,0,0,0,0,0,0,0,0,0
22,22,"We prepared the pitch, questions to the client, poster.",1,0,0,0,0,0,0,0,0,0,0,0,0,0,0,0,0,0,0,0,0,1,0,0,0,0,0,0,0,0,0,0,0,0,0,1,0,0,0,0,0,0,0,0,0,0,0,0,0,0,0,0
23,23,I did some research on other solutions.,1,0,0,0,0,0,0,0,0,0,0,0,0,0,0,0,0,0,0,0,0,1,0,0,0,0,0,0,0,0,0,0,0,0,0,1,0,0,0,0,0,0,0,0,0,0,0,0,0,0,0,0
24,24,We tried to take advantage of every moment to omit the unnecessarily time-wasting.,1,0,0,0,0,0,0,0,0,0,0,0,0,0,0,0,0,0,0,0,0,1,0,0,0,0,0,0,0,0,0,0,0,0,0,1,0,0,0,0,0,0,0,0,0,0,0,0,0,0,0,0
25,25,Each of us analyses the sources from the client and try to find a piece of the solution.,1,0,0,0,0,0,0,0,0,0,0,0,0,0,0,0,0,0,0,0,0,1,0,0,0,0,0,0,0,0,0,0,0,0,0,1,0,0,0,0,0,0,0,0,0,0,0,0,0,0,0,0
26,26,Teamwork is very hard and we have to look for proper communication way.,0,0,0,0,0,0,0,0,0,0,1,0,0,0,0,0,0,0,0,0,0,1,0,0,0,0,0,0,0,0,0,0,0,0,0,0,0,0,0,0,0,0,0,1,0,0,0,0,0,0,0,0
27,27,But we have to be also assertive to not go crazy.,1,0,0,0,0,0,0,0,0,0,0,0,0,0,0,0,0,0,0,0,0,1,0,0,0,0,0,0,0,0,0,0,0,0,0,1,0,0,0,0,0,0,0,0,0,0,0,0,0,0,0,0
28,28,"I admire somebody who can stop and say:  sorry now is time for other stuff, but after of course when this person is engaged strongly in the project.",0,0,0,1,0,0,0,0,0,0,0,0,0,0,0,0,0,0,0,0,0,0,0,0,0,0,0,0,0,0,0,0,0,1,0,1,0,0,0,0,0,0,0,0,0,0,0,0,0,0,0,0
29,29,Sometimes the mind reset is needed for the future brilliant solutions: https: //pl.dreamstime.com/zdj%C4%99cia-stock-kresk%C3%B3wka-ma-pomys%C5%82u-m%C4%99%C5%BCczyzna-image20848883Have a nice week,1,0,0,0,0,0,0,0,0,0,0,0,0,0,0,0,0,0,0,0,0,1,0,0,0,0,0,0,0,0,0,0,0,0,0,1,0,0,0,0,0,0,0,0,0,0,0,0,0,0,0,0
30,30,Overall,0,1,1,0,1,0,0,0,0,0,0,0,0,0,0,0,0,0,0,0,0,0,1,1,0,0,0,0,0,0,0,0,0,1,0,0,0,0,0,0,0,0,0,1,0,0,0,0,0,0,0,0